{
  "schema_version": 1,
  "dataset_hash_version": "sha256-sorted-json-v1",
  "course_id": "big-data-analysis-engineer-written",
  "title": "빅데이터분석기사 필기 자체 생성 연습문제",
  "target_curriculum": {
    "version_id": "dataq-2024-2026",
    "effective_from": "2024-01-01",
    "effective_to": "2026-12-31",
    "sha256": "9f6e0b69e01bac657fe600e4d8996d3853780ba26e9f539f3d2ca15321aa7302"
  },
  "summary": {
    "published_questions": 0,
    "practice_questions": 0
  },
  "questions": [],
  "privacy": {
    "scope": "public",
    "contains_private_content": false
  },
  "dataset_version": "2c2553464c4f8d064332bc6c7993286c3d4c0198ce88bbea2e34318a4e23827a",
  "generated_at": "2026-08-30T10:26:34+09:00"
}
